{
  "schemaVersion": 2,
  "project": {
    "topic": "",
    "audience": "",
    "platform": "",
    "aspectRatio": "9:16",
    "narrationMode": "explainer",
    "targetDurationSeconds": null,
    "distributionProfile": "standard",
    "distributionTargets": []
  },
  "audio": {
    "path": "narration-final.wav",
    "source": "",
    "provider": "",
    "model": "",
    "voice": "",
    "sha256": "",
    "durationSeconds": null,
    "sampleRate": null,
    "channels": null,
    "integratedLufs": null,
    "truePeakDbtp": null,
    "lockedAt": null
  },
  "alignment": {
    "captionsSha256": "",
    "approvedAt": null,
    "reviewer": ""
  },
  "stages": {
    "editorial_brief": "pending",
    "distribution_strategy": "pending",
    "hook_selection": "pending",
    "sources": "pending",
    "article": "pending",
    "narration": "pending",
    "audio_lock": "pending",
    "alignment": "pending",
    "timing": "pending",
    "visual_direction": "pending",
    "runtime_preflight": "pending",
    "first_five_proof": "pending",
    "wechat": "pending",
    "social_cards": "pending",
    "slides": "pending",
    "video_review": "pending",
    "video_final": "pending",
    "distribution_package": "pending",
    "performance_review": "pending"
  },
  "outputs": {
    "editorialBrief": "editorial-brief.json",
    "distributionBrief": "distribution-brief.json",
    "hookPackage": "hook-package.json",
    "firstFiveProof": "first-five-proof.json",
    "sourceVisuals": "source-visuals.json",
    "captions": "captions.json",
    "timing": "timing.json",
    "brandReferences": "brand-references.json",
    "visualDirectionProof": "visual-direction-proof.json",
    "alignmentAdjudication": "timing-work/alignment-adjudication.json",
    "deliveryAudioPreflight": "delivery-audio-preflight.json",
    "runtimePreflight": "runtime-preflight.json",
    "visualProofReport": "visual-proof-report.json",
    "wechatCoverReport": "wechat/cover-report.json",
    "videoReview": "review.mp4",
    "videoReviewReport": "review-report.json",
    "videoFinal": "final.mp4",
    "videoFinalReport": "final-report.json",
    "shortVideoReleasePackage": "short-video/release-package.json",
    "assetInventory": "asset-inventory.json",
    "performanceReview": "short-video/performance-review.json"
  },
  "history": [],
  "notes": []
}
